name,phone,website,address,rating,reviews,city,state,category,place_id,business_status
Visol India - Solar Panel Installation Company in Mumbai,091522 31361,https://visolindia.com/,"Kailas Business Park, Vikhroli (W, HMPL Surya Nagar, Vikhroli West, Mumbai, Maharashtra 400079, India",4.9,47,Mumbai,Maharashtra,Residential Solar Installers,ChIJ8za_dOrH5zsRuDBNTI4lQGc,OPERATIONAL
Solar PV in Mumbai,099202 88031,http://www.solarpvmumbai.com/,"61, Aditya Industrial Estate, Evershine Mall, B/h, New Link Rd, Malad, Mindspace, West, Mumbai, Maharashtra 400064, India",5,26,Mumbai,Maharashtra,Residential Solar Installers,ChIJ______C25zsRPoLLXzND7Fc,OPERATIONAL
Rising Sun Electric | Solar Panel Installation in Mumbai | Solar EPC | Renewable Energy,070212 13467,https://solarrse.com/,"Somaiya Chember, Swami Vivekanand Rd, opp. Metro Shoes, Malad, Vijaykar Wadi Industrial, Vijaykar Wadi, Malad West, Mumbai, Maharashtra 400064, India",5,47,Mumbai,Maharashtra,Residential Solar Installers,ChIJYQQRUk-35zsReEBqh7w-3Jc,OPERATIONAL
UNISUN Power Solutions Pvt Ltd | India's Best Solar Company,081696 94414,https://unisunpowersolutions.com/,"221, Hari Om Plaza, Mahatma Gandhi Rd, near Omkareshwar Temple, Sukarwadi, Borivali East, Mumbai, Maharashtra 400066, India",4.5,117,Mumbai,Maharashtra,Residential Solar Installers,ChIJzY9hKq6x5zsRj1sNk5LUu6A,OPERATIONAL
ReNova Pulse Energy Pvt. Ltd. | Solar Rooftop for Industrial and Residential,097026 14565,https://www.renovapulseenergy.com/,"KAILASH BUSINESS PARK, A-216, Veer Sawarkar Marg, HMPL सुर्या नगर, विखरवली वेस्ट, मुंबई, महाराष्ट्र 400079, India",4.8,61,Mumbai,Maharashtra,Residential Solar Installers,ChIJTT44xe7H5zsRGVdbjsXf-EY,OPERATIONAL
Priority Solar Solutions Pvt. Ltd. | Solar Rooftop for Industrial and Residential,,http://www.prioritysolarsolutions.com/,"Mahatma Gandhi Rd, Hindustan Naka, Mahatma Gandhi Nagar, Kandivali West, Mumbai, Maharashtra 400067, India",4.9,19,Mumbai,Maharashtra,Residential Solar Installers,ChIJ1VVsNW-35zsRuKWor9HtvBQ,OPERATIONAL
Avni Solar,084337 99330,http://www.avnisolar.in/,"Master Mind, A321, Royal Palms, Aarey Milk Colony, Goregaon, Mumbai, Maharashtra 400065, India",5,41,Mumbai,Maharashtra,Residential Solar Installers,ChIJ4zlb_aG35zsR3xcYD_xKYyk,OPERATIONAL
Go Mumbai Solar LLP EPC,084336 00378,https://mumbaisolar.in/,"Shop No : 14, B Wing , Chuim Village Road, Jai Hind Trimurti CHS, 16th Rd, Pyari Nagar, Hanuman Nagar, Khar West, Mumbai, Maharashtra 400052, India",5,12,Mumbai,Maharashtra,Residential Solar Installers,ChIJe3xzdHTJ5zsRwcN1AV31stE,OPERATIONAL
Tech Solar Solutions Pvt. Ltd.,022 2269 3747,http://www.techsolar.org/,"Office No. 10, 2nd Floor, Friends Union Co-op Building Society, 227, P D'Mello Rd, next to Manama Hotel, Indira Docks, Mumbai Port Trust, Mazgaon, Mumbai, Maharashtra 400001, India",5,15,Mumbai,Maharashtra,Residential Solar Installers,ChIJ5Qb72QnR5zsRK_ZbWsoIdV8,OPERATIONAL
Nikev Energies | Solar Rooftop System in Mumbai | Solar Panel | Solar Installation | Solar Inverter,086558 04599,http://nikevenergies.com/,"Ground Floor, Shree Naman Plaza, Swami Vivekanand Rd, near Rajguru Flyover, Kandivali, Bhadran Nagar, Kandivali West, Mumbai, Maharashtra 400067, India",4.5,16,Mumbai,Maharashtra,Residential Solar Installers,ChIJwdll9uu35zsRbfcSMljJMbw,OPERATIONAL
NUCLEUS POWER SOLUTIONS-Best Inverter Battery Supplier in Navi Mumbai,090762 62727,,"Office 106, Annexe, Plot No - 18, Nilesh Chambers, Palm Beach Rd, Juhu Nagar, Sector 19C, APMC Market 1, Vashi, Navi Mumbai, Maharashtra 400703, India",4.9,113,Mumbai,Maharashtra,Solar Inverter Specialists,ChIJ96X9WKLD5zsRcXi-qBExMe8,OPERATIONAL
Phoenix Power Solution / Inverter Battery Dealer / Exide Batteries Wholesaler In Dombivali,070215 36918,http://www.phoenixpowersolution.com/,"Shop No 6 Jay Maruti Darshan Building CHS Chheda Road, Phadke Rd, nr. Ganpati Mandir, Pendse Nagar, Dombivli East, Dombivli, Maharashtra 421201, India",4.9,304,Mumbai,Maharashtra,Solar Inverter Specialists,ChIJCW2qX8iV5zsRwICpAtPC8xI,OPERATIONAL
PowerCare Techno Solutions - UPS Battery Manufacturer Dealer & Distributor in Mumbai,,,"Sahyadri Nagar, RC Marg, Vashinaka, Chembur, Mumbai, Maharashtra 400074, India",5,20,Mumbai,Maharashtra,Solar Inverter Specialists,ChIJkz3SNnrF5zsRqjxTlZgsGFk,OPERATIONAL
UTL Solar Distributor | Solar Inverter | Solar Panel | Battery - Sunfriend Power,08071 264 675,https://dealers.upsinverter.com/utl-solar/panvel/Vadghar/utl-solar-distributor-in-Vadghar-panvel--5iLxiN/home,"Shope No. 05, Sai Dham, Plot No. 148, Karnjade, Sector - R3, Pushpak Nagar, Vadghar, Panvel, Navi Mumbai, Maharashtra 410206, India",4.6,18,Mumbai,Maharashtra,Solar Inverter Specialists,ChIJm8o2JEDp5zsRWznxblc9zBg,OPERATIONAL
"POWERTUNE | Inverter,lift inverter, Online UPS, Battery, Solar Panel Dealer",076209 04539,https://upsbatterysolar.com/,"Shop no. 11, CHS Ltd, Near, Badlapur Sta Rd, behind Dhanvantri Hospital, Patil Pada, Station Pada, Badlapur, Maharashtra 421503, India",4.7,20,Mumbai,Maharashtra,Solar Inverter Specialists,ChIJx54uhK2_5zsR7NxndnRI_EA,OPERATIONAL
Absolute Power Solutions,095944 16665,https://www.absoluteups.com/,"9, Kakasaheb Gadgil Marg, opp. Antariksha building, M.B Kowli Wadi, Dadar West, Prabhadevi, Mumbai, Maharashtra 400025, India",5,28,Mumbai,Maharashtra,Solar Inverter Specialists,ChIJuY81--nO5zsRz9IEdzLAgcM,OPERATIONAL
WAAREE Group,022 6644 4444,https://www.waaree.com/,"Western Edge I, 602, off Western Express Highway, Food Corporation of India Warehouse, Borivali East, Mumbai, Maharashtra 400066, India",4.6,96,Mumbai,Maharashtra,Solar Inverter Specialists,ChIJRxrdVjK35zsRPIYrUGoW2mo,OPERATIONAL
Solarica System,,,"shree row house, F44/32, near Shiva ji Chowk, Block G, Sector 12, Kharghar, Navi Mumbai, Maharashtra 410210, India",4.7,13,Mumbai,Maharashtra,Solar Inverter Specialists,ChIJVVVVVfHB5zsRvjvif71ynS4,OPERATIONAL
Nalanda Inverter & Airconditioner Authorised Luminous distributor in raigad/ Navi mumbai,093241 78555,,"Plot No.162, Arihant Plaza, Vasudev Balwant Phadke Rd, MCCH Society, Panvel, Navi Mumbai, Maharashtra 410206, India",4.7,43,Mumbai,Maharashtra,Solar Inverter Specialists,ChIJIayQn2vo5zsR-U76_EO9OVY,OPERATIONAL
Cymoline Sales Corporation,093246 92404,http://www.cymoline.net/,"Shop No 12, Smashaan bhoomi, Om Sai Vyapari Mandal, Ghatkopar, Ghatkopar - Mahul Rd, near Meghraj Hotel, nr. Ghatkopar Smashaan, Vidyanagar, Vidya Vihar East, Chembur, Mumbai, Maharashtra 400077, India",4.8,22,Mumbai,Maharashtra,Solar Inverter Specialists,ChIJGW5_ciHP5zsRH7ICc69otww,OPERATIONAL
Sunwave Solar Power Cleaning service & solution,098675 02760,http://sunwavesolarpower.com/,"A Wing, Ground Floor, 001 Mandakini Building, Bus Stop, near Dahisar East, Mandakini Cooperative Housing Society Limited, Mahavir Nagar, Dahisar East, Mumbai, Maharashtra 400068, India",5,5,Mumbai,Maharashtra,Solar AMC & Maintenance,ChIJSb9UBkKx5zsR1qLU6fQIlwo,OPERATIONAL
Go Mumbai Solar LLP EPC,084336 00378,https://mumbaisolar.in/,"Shop No : 14, B Wing , Chuim Village Road, Jai Hind Trimurti CHS, 16th Rd, Pyari Nagar, Hanuman Nagar, Khar West, Mumbai, Maharashtra 400052, India",5,12,Mumbai,Maharashtra,Solar AMC & Maintenance,ChIJe3xzdHTJ5zsRwcN1AV31stE,OPERATIONAL
Avishakti Rooftop Solar Pvt Ltd,081698 22469,http://avishaktisolar.com/,"211, A-WING, Centrum Business Square, Road No. 16, नेहेरू नगर, वागळे इंडस्ट्रियल इस्टेट, ठाणे वेस्ट, ठाणे, महाराष्ट्र 400604, India",5,10,Mumbai,Maharashtra,Solar AMC & Maintenance,ChIJa7NU7iTO5zsRqL63RP6qwp0,OPERATIONAL
Solar Assist,090226 50560,,"Hermes Atrium, Unit No.: 309, A - Wing, Sector 11, CBD Belapur, Navi Mumbai, Maharashtra 400614, India",5,2,Mumbai,Maharashtra,Solar AMC & Maintenance,ChIJYQ8xpIjD5zsR3T_rCWBKpgg,OPERATIONAL
Proficience Solar Systems,080808 18248,http://www.proficiencesystems.com/,"Mahadev Complex, Behind Kutirodyog Bhavan Netaji Subhash Path Next to Shri Kopineshwar Temple, near Bramhan Sabha Sabhagruha, Jambli Naka, Thane West, Thane, Maharashtra 400601, India",4.8,49,Mumbai,Maharashtra,Solar AMC & Maintenance,ChIJhffAY0K55zsR8iAhYwi6lGQ,OPERATIONAL
Rising Sun Electric | Solar Panel Installation in Mumbai | Solar EPC | Renewable Energy,070212 13467,https://solarrse.com/,"Somaiya Chember, Swami Vivekanand Rd, opp. Metro Shoes, Malad, Vijaykar Wadi Industrial, Vijaykar Wadi, Malad West, Mumbai, Maharashtra 400064, India",5,47,Mumbai,Maharashtra,Solar AMC & Maintenance,ChIJYQQRUk-35zsReEBqh7w-3Jc,OPERATIONAL
Kavish Eco Energy Solutions,099203 36365,http://www.kavishenergy.com/,"The Palazzo, C 103, in front of Mandapeshwar Sub-Post office, I C Colony, Borivali West, Mumbai, Maharashtra 400103, India",5,32,Mumbai,Maharashtra,Solar AMC & Maintenance,ChIJw6CcIUaw5zsRSbMN0E6YhKM,OPERATIONAL
SunDesh Solar Systems & Services Marketing India Pvt Ltd,099590 13982,http://www.sundeshsolar.com/,"1, Sun Heights, Suncity Complex, Venus CHS, HMPL Surya Nagar, Powai, Mumbai, Maharashtra 400076, India",5,1,Mumbai,Maharashtra,Solar AMC & Maintenance,ChIJfRz_6VrH5zsRANCT2fADKnw,OPERATIONAL
Soururja Solution,070210 85155,http://www.soururjasolution.in/,"2-511, Shree Tirupati Balaji CHS, Sahar Rd, Koldongri, Andheri East, Mumbai, Maharashtra 400069, India",5,30,Mumbai,Maharashtra,Solar AMC & Maintenance,ChIJM7msjMzJ5zsRhQNTXVcZOhU,OPERATIONAL
ReNova Pulse Energy Pvt. Ltd. | Solar Rooftop for Industrial and Residential,,,"KAILASH BUSINESS PARK, A-216, Veer Sawarkar Marg, HMPL सुर्या नगर, विखरवली वेस्ट, मुंबई, महाराष्ट्र 400079, India",4.8,61,Mumbai,Maharashtra,Solar AMC & Maintenance,ChIJTT44xe7H5zsRGVdbjsXf-EY,OPERATIONAL
SAWERI URJA Pvt. Ltd.,,,"Saiyad ul Ajaib, Sainik Farm, New Delhi, Delhi 110030, India",4.9,183,Delhi,Delhi,Commercial Solar Installers,ChIJBQAAUfvhDDkRaMqkXqSEbno,OPERATIONAL
J S SOLARTECH INDIA PRIVATE LIMITED,098108 05360,http://www.jssolartech.com/,"46, B Block, DDA Market, Pushpanjali Enclave, Pitampura, Delhi, 110034, India",4.9,151,Delhi,Delhi,Commercial Solar Installers,ChIJJ4-tFPoDDTkR0W4G7Gx6E20,OPERATIONAL
Nav Solar Power Pvt. Ltd. | Best Solar Company in Delhi NCR,092059 18380,https://navsolarpower.com/,"Mohan Sadan, BH Market, 202/5, near Police Station, Poorbi Shalimar Bag, Shalimar Bagh, New Delhi, Delhi, 110088, India",4.9,54,Delhi,Delhi,Commercial Solar Installers,ChIJea5RUpcBDTkRVd7zQ6boN5A,OPERATIONAL
"Alien Energy Solar - Best Solar Energy Company in Delhi, NCR India | Solar Rooftop Company in Delhi, India",1800 309 2201,https://alienenergy.in/solar-company-in-india,"Ground Floor, 91, Kiran Vihar, Karkardooma, Anand Vihar, Delhi, 110092, India",4.6,45,Delhi,Delhi,Commercial Solar Installers,ChIJK5tk9Pn7DDkRaUu8IWXGKek,OPERATIONAL
GeoPower India Pvt Ltd,097117 94449,https://geosolar.in/,"A-87, Shivalik Rd, Block C, Shivalik Colony, Malviya Nagar, New Delhi, Delhi 110017, India",4.5,128,Delhi,Delhi,Commercial Solar Installers,ChIJJTmX5RviDDkR7hYFMtMNsnQ,OPERATIONAL
"Solar India Enterprises supplier & manufactures Of solar panel, solar water heater & solar power plant in Delhi",098116 06202,https://www.solarindiaent.com/,"M-5/4-5-6, Vishal Market, West Mukherjee Nagar, Delhi - 110 009, India, West Mukherjee Nagar, Mukherjee Nagar, Delhi, 110033, India",4.6,48,Delhi,Delhi,Commercial Solar Installers,ChIJ67gPhfv9DDkROwxSrT4EgNc,OPERATIONAL
SOLAR-MAIT India,,,"2nd Floor, Plot No 14 & 15, Najafgarh Rd, above SBI Bank, Ranaji Enclave, Masudabad, Nangli Sakrawati, New Delhi, Delhi, 110043, India",4.8,127,Delhi,Delhi,Commercial Solar Installers,ChIJrcvWplQDDTkRl5uIO3FwGiA,OPERATIONAL
Oakridge Energy - Leading Solar Developer for Commercial & Industrial Establishments,099717 38111,https://www.oakridge.co.in/,"B 6/13, B6, Block B6, Humayunpur, Safdarjung Enclave, New Delhi, Delhi 110029, India",4.2,22,Delhi,Delhi,Commercial Solar Installers,ChIJTbHwAXriDDkR3gFIjD7wNI8,OPERATIONAL
Exolar Energy Private Limited,093191 79678,http://exolarenergy.com/,"405, Pearls Best Heights-1, Netaji Subhash Place, Pitampura, Delhi, 110034, India",4.9,41,Delhi,Delhi,Commercial Solar Installers,ChIJzauMzIcBDTkR3Gp8qd0QRYk,OPERATIONAL
India Solar Energies,099904 91143,http://www.indsolars.in/,"Gali Number 6, near Musa apartment, Block S, Jogabai Extension, Zakir Nagar, Okhla, New Delhi, Delhi 110025, India",4.8,62,Delhi,Delhi,Commercial Solar Installers,ChIJBdoXSB3jDDkRDBClUPTr7Ug,OPERATIONAL
"Solar India Enterprises supplier & manufactures Of solar panel, solar water heater & solar power plant in Delhi",098116 06202,https://www.solarindiaent.com/,"M-5/4-5-6, Vishal Market, West Mukherjee Nagar, Delhi - 110 009, India, West Mukherjee Nagar, Mukherjee Nagar, Delhi, 110033, India",4.6,48,Delhi,Delhi,Solar Panel Dealers,ChIJ67gPhfv9DDkROwxSrT4EgNc,OPERATIONAL
SOLAR-MAIT India,,,"2nd Floor, Plot No 14 & 15, Najafgarh Rd, above SBI Bank, Ranaji Enclave, Masudabad, Nangli Sakrawati, New Delhi, Delhi, 110043, India",4.8,127,Delhi,Delhi,Solar Panel Dealers,ChIJrcvWplQDDTkRl5uIO3FwGiA,OPERATIONAL
J S SOLARTECH INDIA PRIVATE LIMITED,098108 05360,http://www.jssolartech.com/,"46, B Block, DDA Market, Pushpanjali Enclave, Pitampura, Delhi, 110034, India",4.9,151,Delhi,Delhi,Solar Panel Dealers,ChIJJ4-tFPoDDTkR0W4G7Gx6E20,OPERATIONAL
REPUBLIC SOLAR ( RPS) by Kamal Sound,098105 80436,https://www.facebook.com/abhishek.chowdhary.771?mibextid=ZbWKwL,"Stall No-60, 63, Diwan Hall Rd, near Moti Cinema Balkani Gate, opp. Grover Fruit Juice, Lajpat Rai Market, Chandni Chowk, New Delhi, Delhi, 110006, India",4.6,350,Delhi,Delhi,Solar Panel Dealers,ChIJv5WRYhz9DDkRE9yc6MfIKEE,OPERATIONAL
Amdi Enterprises,080762 74063,,"Block B, Sector 53, Noida, Uttar Pradesh 201301, India",4.9,144,Delhi,Delhi,Solar Panel Dealers,ChIJnW51dATlDDkRhycTi6L8Igw,OPERATIONAL
Pronounce Solar | Pronounce Sunhealth Services Pvt Ltd,083686 03894,https://pronouncesolar.in/,"First Floor, Plot No 30, Masoodpur Dairy, near JIMS, Masoodpur, Sector B, Vasant Kunj, New Delhi, Delhi 110070, India",4.7,162,Delhi,Delhi,Solar Panel Dealers,ChIJFZqfcPAfDTkRrwA2OChbZHM,OPERATIONAL
Bluebird Solar Pvt. Ltd.,,,"70, Fisrt Floor, Rajasthani Udyog Nagar Industrial Area, GT Karnal Rd, Block A, Jahangirpuri, Delhi, 110033, India",4.7,257,Delhi,Delhi,Solar Panel Dealers,ChIJW6Hs3ZABDTkRFk_Wvb8b9B8,OPERATIONAL
FRIEND SOLAR POWERTEK - BATTERYLESS INVERTER MANUFACTURERS IN DELHI | UPS MANUFACTURERS | SUPPLIERS | WHOLESALER | DEALER,092208 32177,https://friendsolars.com/,"25/3/1, Najafgarh Rd, Nangli Vihar Extension Part 1, nangali sakrawati industrial area, mahendra Park, Najafgarh, Delhi, 110043, India",5,9,Delhi,Delhi,Solar Panel Dealers,ChIJ-X5xdM0PDTkRsn6er-kEumo,OPERATIONAL
Solar Universe India Pvt. Ltd.,098102 88787,http://www.solaruniverseindia.com/,"A- 50/2, Block A, Mayapuri Industrial Area Phase I, Mayapuri, New Delhi, Delhi, 110064, India",3.9,17,Delhi,Delhi,Solar Panel Dealers,ChIJn-C-9mb9DDkRy1j2NxyxE_I,OPERATIONAL
sevenp solar energy pvt. ltd.,099998 10894,http://www.sevenpsolarenergy.com/,"286, Pocket 1, Sector 25, Rohini, Delhi, 110085, India",4.8,33,Delhi,Delhi,Solar Panel Dealers,ChIJGb5DQVcHDTkRQTJ2ELzyI0I,OPERATIONAL
J S SOLARTECH INDIA PRIVATE LIMITED,098108 05360,http://www.jssolartech.com/,"46, B Block, DDA Market, Pushpanjali Enclave, Pitampura, Delhi, 110034, India",4.9,151,Delhi,Delhi,Solar Inverter Specialists,ChIJJ4-tFPoDDTkR0W4G7Gx6E20,OPERATIONAL
"UTL Solar: Solar Company in Delhi, India",092508 85885,https://www.upsinverter.com/,"53 A/6, Rama Road Industrial Area, Near Sat Guru ram Singh Metro Station, Block B, Najafgarh Road Industrial Area, New Delhi, Delhi, 110015, India",4,376,Delhi,Delhi,Solar Inverter Specialists,ChIJd-3rnjD9DDkRX8Jd0xsrBd4,OPERATIONAL
"ABTON POWER DEVICES PVT LTD ( INVERTER, BATTERY & UPS )",098186 15350,https://inverterworld.in/,"shop no 45 , DDA local shopping center(LSC) mangla market , adjoining KALKAJI Head Post OFFICE, Block DD, Kalkaji Extension, Kalkaji, New Delhi, Delhi 110019, India",4.6,397,Delhi,Delhi,Solar Inverter Specialists,ChIJ68d22dvjDDkRhZ3aRzX3R8M,OPERATIONAL
Jangra Batteries & Solar Systems LLP,078619 58315,https://jangrabatteries.co.in/,"Plot No Wz 182, near Corporation Bank, Palam Village, Palam, New Delhi, Delhi, 110045, India",4.7,662,Delhi,Delhi,Solar Inverter Specialists,ChIJOQ_vWEAbDTkRezepJQO8zBs,OPERATIONAL
FRIEND SOLAR POWERTEK - BATTERYLESS INVERTER MANUFACTURERS IN DELHI | UPS MANUFACTURERS | SUPPLIERS | WHOLESALER | DEALER,092208 32177,https://friendsolars.com/,"25/3/1, Najafgarh Rd, Nangli Vihar Extension Part 1, nangali sakrawati industrial area, mahendra Park, Najafgarh, Delhi, 110043, India",5,9,Delhi,Delhi,Solar Inverter Specialists,ChIJ-X5xdM0PDTkRsn6er-kEumo,OPERATIONAL
"Solar India Enterprises supplier & manufactures Of solar panel, solar water heater & solar power plant in Delhi",098116 06202,https://www.solarindiaent.com/,"M-5/4-5-6, Vishal Market, West Mukherjee Nagar, Delhi - 110 009, India, West Mukherjee Nagar, Mukherjee Nagar, Delhi, 110033, India",4.6,48,Delhi,Delhi,Solar Inverter Specialists,ChIJ67gPhfv9DDkROwxSrT4EgNc,OPERATIONAL
Smarten Power Systems Ltd.,093196 99755,https://smartenpowersystems.in/,"Plot No -374, Pace City-II, Sector 37, Udyog Vihar Industrial Area Phase VI, Sector 37, Gurugram, Haryana 122004, India",4.5,1148,Delhi,Delhi,Solar Inverter Specialists,ChIJBchIBvIXDTkRI6Bc5cvFC3E,OPERATIONAL
SOLAR-MAIT India,084484 46252,https://solarmait.com/,"2nd Floor, Plot No 14 & 15, Najafgarh Rd, above SBI Bank, Ranaji Enclave, Masudabad, Nangli Sakrawati, New Delhi, Delhi, 110043, India",4.8,127,Delhi,Delhi,Solar Inverter Specialists,ChIJrcvWplQDDTkRl5uIO3FwGiA,OPERATIONAL
Pronounce Solar | Pronounce Sunhealth Services Pvt Ltd,083686 03894,https://pronouncesolar.in/,"First Floor, Plot No 30, Masoodpur Dairy, near JIMS, Masoodpur, Sector B, Vasant Kunj, New Delhi, Delhi 110070, India",4.7,162,Delhi,Delhi,Solar Inverter Specialists,ChIJFZqfcPAfDTkRrwA2OChbZHM,OPERATIONAL
SUNNYY INVERTOR & BATTERY,092128 64442,,"A-43, Rama Park Rd, Rama Park, Block A, Rama Park, Dwarka, New Delhi, Delhi, 110059, India",4.8,201,Delhi,Delhi,Solar Inverter Specialists,ChIJaynxEDkFDTkRXu1mpaMgaLw,OPERATIONAL
EcoSoch Solar Private Limited,081234 10101,https://www.ecosoch.com/,"940, 2nd phase, Sha Arcade, Nti Layout, Rajiv Gandhi Nagar, Kodigehalli, Bengaluru, Karnataka 560097, India",4.8,219,Bangalore,Karnataka,Residential Solar Installers,ChIJn6YyeBkYrjsRsf-1r6edKIo,OPERATIONAL
Power Planet - Best Solar Company in Bangalore,094839 79469,https://powerplanetindia.com/,"Nagarabhavi Main Rd, 2nd Block, Maruthi Nagar, Bengaluru, Karnataka 560072, India",4.9,97,Bangalore,Karnataka,Residential Solar Installers,ChIJX_Kj0wg_rjsRJynEtsBSpZM,OPERATIONAL
Orange Energy - Best Solar Company in Bangalore | Top Solar Panel Dealer | Best Solar System Company,099809 11183,https://orangeenergy.in/,"11, 3rd Cross Rd, Bachappa Layout, B Channasandra, Kasturi Nagar, Bengaluru, Karnataka 560043, India",5,35,Bangalore,Karnataka,Residential Solar Installers,ChIJPaehqc8RrjsR2p9lf0_rq-o,OPERATIONAL
Kamal Solar Head office,098807 39199,http://kamalsolar.com/,"Kamal Solar, 1445/4, Railway Parallel Rd, C Block, Sahakar Nagar, Bengaluru, Karnataka 560092, India",4.9,1017,Bangalore,Karnataka,Residential Solar Installers,ChIJz39aAZMXrjsRPNWezR-8y3w,OPERATIONAL
Supreme Solar Projects Private Limited,093796 61979,http://www.supremesolar.in/,"1st & 2nd Floor, 687, 3rd A Cross Rd, opp. Seshadripuram College, Yelahanka Satellite Town, Yelahanka New Town, Bengaluru, Karnataka 560064, India",4.5,789,Bangalore,Karnataka,Residential Solar Installers,ChIJb3hc_44XrjsRqx-9xInqy4k,OPERATIONAL
SunTrop Solar Pvt Ltd,080 2311 9520,http://www.suntropsolar.com/,"2nd floor, 31, 9th Main Rd, RPC layout, Hampi Nagar, Vijaya Nagar II Stage, Vijayanagar, Bengaluru, Karnataka 560104, India",4.8,107,Bangalore,Karnataka,Residential Solar Installers,ChIJGeY9hnQ-rjsRYBxeQnuXBP8,OPERATIONAL
Superior Solar Systems,,,"60/1, 80 Feet Ring Road, Mariyappanapalya Circle, Post, Gnana Bharathi, Bengaluru, Karnataka 560056, India",4.8,984,Bangalore,Karnataka,Residential Solar Installers,ChIJy-mglKw_rjsR2YQvtRuDcJA,OPERATIONAL
Vision Solar Systems | Solar Water Heater Supplier,096869 09083,https://visionsolarsystems.com/,"No 63, Ground Floor, 6th Cross Erappa Reddy Layout Parappana Agrahara, Manjunatha Nagar, Sai Sree Layout, Electronic City, Bengaluru, Karnataka 560100, India",4.9,142,Bangalore,Karnataka,Residential Solar Installers,ChIJLc74pVttrjsRh6YmQo-Qy6c,OPERATIONAL
SolarOhms Renewable Energy,,,"Vrindavanam, 4th Cross Road, #38, Oil Mill Rd, Peace Layout, Lingarajapuram, Bengaluru, Karnataka 560084, India",4.9,38,Bangalore,Karnataka,Residential Solar Installers,ChIJkRxMP-AWrjsRGGrL6AgtYCA,OPERATIONAL
Orb Energy,,,"95, Digital Park Rd, 2nd Stage, Yeswanthpur, Bengaluru, Karnataka 560022, India",4.7,903,Bangalore,Karnataka,Residential Solar Installers,ChIJO0d44tw9rjsRl_UgRi5Bg_o,OPERATIONAL
EcoSoch Solar Private Limited,081234 10101,https://www.ecosoch.com/,"940, 2nd phase, Sha Arcade, Nti Layout, Rajiv Gandhi Nagar, Kodigehalli, Bengaluru, Karnataka 560097, India",4.8,219,Bangalore,Karnataka,Commercial Solar Installers,ChIJn6YyeBkYrjsRsf-1r6edKIo,OPERATIONAL
Power Planet - Best Solar Company in Bangalore,094839 79469,https://powerplanetindia.com/,"Nagarabhavi Main Rd, 2nd Block, Maruthi Nagar, Bengaluru, Karnataka 560072, India",4.9,97,Bangalore,Karnataka,Commercial Solar Installers,ChIJX_Kj0wg_rjsRJynEtsBSpZM,OPERATIONAL
Orange Energy - Best Solar Company in Bangalore | Top Solar Panel Dealer | Best Solar System Company,099809 11183,https://orangeenergy.in/,"11, 3rd Cross Rd, Bachappa Layout, B Channasandra, Kasturi Nagar, Bengaluru, Karnataka 560043, India",5,35,Bangalore,Karnataka,Commercial Solar Installers,ChIJPaehqc8RrjsR2p9lf0_rq-o,OPERATIONAL
SunTrop Solar Pvt Ltd,080 2311 9520,http://www.suntropsolar.com/,"2nd floor, 31, 9th Main Rd, RPC layout, Hampi Nagar, Vijaya Nagar II Stage, Vijayanagar, Bengaluru, Karnataka 560104, India",4.8,107,Bangalore,Karnataka,Commercial Solar Installers,ChIJGeY9hnQ-rjsRYBxeQnuXBP8,OPERATIONAL
Dexler Energy Pvt. Ltd.,080 4070 9000,http://www.dexlerenergy.com/,"IndiQube, 2nd Floor, Lexington Towers, Tavarekere Main Rd, Tavarekere, Chikka Adugodi, S.G. Palya, Bengaluru, Karnataka 560029, India",4.5,27,Bangalore,Karnataka,Commercial Solar Installers,ChIJ1YxTzRsUrjsRh-X2tfVDHfg,OPERATIONAL
SunPV Energy Private Limited,096639 05993,http://www.sunpvenergy.com/,"345, 22nd Cross Rd, 7th Sector, HSR Layout, Bengaluru, Karnataka 560102, India",5,19,Bangalore,Karnataka,Commercial Solar Installers,ChIJ9eeQ4DcRrjsRbGEwueWksiM,OPERATIONAL
Enerparc Energy Pvt. Ltd.,080 4941 4941,https://enerparc.in/,"No. 58, H M Towers, Unit No. 401, 4th Floor Eastern Wing, Brigade Rd, Ashok Nagar, Bengaluru, Karnataka 560025, India",4.9,27,Bangalore,Karnataka,Commercial Solar Installers,ChIJ26rsyYoXrjsRwMuyTskjrco,OPERATIONAL
Mecwin Technologies India Pvt Ltd - EV Motors and Solar Pumps,097412 29797,http://www.mecwinindia.com/,"65/3-1, opposite to Super Gas filling station, Yeshwanthpur Industrial Suburb, Yeswanthpur, Bengaluru, Karnataka 560022, India",4.8,359,Bangalore,Karnataka,Commercial Solar Installers,ChIJ7WzCbnE7rjsRjzvVaTT4hh8,OPERATIONAL
Skyfri Energy Private Limited,080 2359 8018,http://www.skyfri.com/,"No 527/B, Tejas Arcade, Regus Co-working 324, 4th Floor, 1st Main Road Dr, Dr Rajkumar Rd, A Block, Milk Colony, 2nd Stage, Rajajinagar, Bengaluru, Karnataka 560010, India",4.4,48,Bangalore,Karnataka,Commercial Solar Installers,ChIJTVbDbykWrjsRj6GqgdmuWes,OPERATIONAL
Kaval Power Private Limited,095353 00288,http://www.kavalgroup.com/,"2nd Floor, Corporate Miller, 332, Thimmaiah Rd, Govinda Chetty Colony, Vasanth Nagar, Bengaluru, Karnataka 560001, India",5,33,Bangalore,Karnataka,Commercial Solar Installers,ChIJt0xtNZw9rjsR28nQcYRqDbI,OPERATIONAL
Kamal Solar Head office,098807 39199,http://kamalsolar.com/,"Kamal Solar, 1445/4, Railway Parallel Rd, C Block, Sahakar Nagar, Bengaluru, Karnataka 560092, India",4.9,1017,Bangalore,Karnataka,Solar Panel Dealers,ChIJz39aAZMXrjsRPNWezR-8y3w,OPERATIONAL
EcoSoch Solar Private Limited,081234 10101,https://www.ecosoch.com/,"940, 2nd phase, Sha Arcade, Nti Layout, Rajiv Gandhi Nagar, Kodigehalli, Bengaluru, Karnataka 560097, India",4.8,219,Bangalore,Karnataka,Solar Panel Dealers,ChIJn6YyeBkYrjsRsf-1r6edKIo,OPERATIONAL
Orange Energy - Best Solar Company in Bangalore | Top Solar Panel Dealer | Best Solar System Company,099809 11183,https://orangeenergy.in/,"11, 3rd Cross Rd, Bachappa Layout, B Channasandra, Kasturi Nagar, Bengaluru, Karnataka 560043, India",5,35,Bangalore,Karnataka,Solar Panel Dealers,ChIJPaehqc8RrjsR2p9lf0_rq-o,OPERATIONAL
Konark Solar,073380 10012,,"21, Dwarka Rd, Doddabommasandra, Vidyaranyapura, Deshbandhunagara, Bengaluru, Karnataka 560097, India",4.9,174,Bangalore,Karnataka,Solar Panel Dealers,ChIJx7OQHJQZrjsRw4AgSKVaV-g,OPERATIONAL
Power Planet - Best Solar Company in Bangalore,094839 79469,https://powerplanetindia.com/,"Nagarabhavi Main Rd, 2nd Block, Maruthi Nagar, Bengaluru, Karnataka 560072, India",4.9,97,Bangalore,Karnataka,Solar Panel Dealers,ChIJX_Kj0wg_rjsRJynEtsBSpZM,OPERATIONAL
Pai Power Solutions: Top Solar Product Supplier & Dealer in Bangalore,090089 02222,https://paisolar.in/,"Ambika Conner, West Side Service Road, 3M-219, Outer Ring Rd, East of NGEF Layout, Kasturi Nagar, Bengaluru, Karnataka 560043, India",4.5,140,Bangalore,Karnataka,Solar Panel Dealers,ChIJ_Rwy0C8RrjsR1f2a8ioujYA,OPERATIONAL
SUPREME SOLAR DISTRIBUTOR SALES AND SERVICES,098441 41862,,"38, hosahalli Road Hosahalli road, Magadi Main Rd, near Mahaveer appartment, Kempegowdanagar, Andrahalli, Bengaluru, Lingadeeranhalli, Karnataka 560091, India",4.8,43,Bangalore,Karnataka,Solar Panel Dealers,ChIJnbp1-v09rjsRpWeuiYM9LT8,OPERATIONAL
